filename_only	use_xml	title	title_locations	methods_sections	content_locations	content_locations_filtered	location_sentences
SUN, CHEN et al. - INTEGRATION OF TIME SERIES SENTINEL1	True	Integration of Time Series Sentinel-1 and Sentinel-2 Imagery for Crop Type Mapping over Oasis Agricultural Areas		['2. Materials and Methods', '2.1. Study Area']	Bayingolin Mongol Autonomous Prefecture, Xinjiang Uyghur Autonomous Region, China,; Tianshan Mountains,; Tarim Basin,; Bosten Lake,; Taklimakan Desert; Northwest China; Google; ArcGIS Data Management	Bayingolin Mongol Autonomous Prefecture, Xinjiang Uyghur Autonomous Region, China,; Tianshan Mountains,; Tarim Basin,; Bosten Lake,; Taklimakan Desert; Northwest China	['The study area is located in oasis agricultural areas in Bayingolin Mongol Autonomous Prefecture, Xinjiang Uyghur Autonomous Region, China, encompassing the area 40.61 –42.44 N, 85.82 –87.14 E (Figure 1).', 'This area is situated in the southern foothills of the Tianshan Mountains, on the north-eastern edge of the Tarim Basin, adjacent to the west bank of Bosten Lake, and to the north of the Taklimakan Desert.', 'It has a representative planting pattern in the arid and semi-arid regions of Northwest China.']
SUN, LUO et al. - SYNCHRONOUS RESPONSE ANALYSIS OF FEATURES	True	Synchronous Response Analysis of Features for Remote Sensing Crop Classification Based on Optical and SAR Time-Series Data		['2. Methodology', '3.2. Study Area']	Ningxia Hui Autonomous Region in China (; SAR; Zhongning County; Yellow River,; Yellow River; Zhongning County; Zhongning County	Ningxia Hui Autonomous Region in China (; Zhongning County; Yellow River,; Yellow River; Zhongning County; Zhongning County	['Zhongning is a county that belongs to the Ningxia Hui Autonomous Region in China (Figure 6a).', 'Thus, we selected Zhongning County as the study area.', 'In the north of this county is the Yellow River, and there are extensive mountain ranges in the southern area, which makes it unsuitable for crops.', 'The northern part of the county belongs to the Yellow River basin and features widespread plains with fertile soil; thus, this area is the main agricultural region in Zhongning County.', 'The brightest region here in Zhongning County is the major agricultural area, and the regions with red features are the mountainous areas, which have a strong backscatter intensity.']
SVENDSEN, SKRIVER et al. - INVESTIGATION OF POLARIMETRIC SAR DATA	False	Investigation of Polarimetric SAR Data Acquired at Multiple Incidence Angles		[]			
TAMIMINIA, HOMAYOUNI et al. - CLUSTERING OF MULTITEMPORAL FULLY POLARIMETRIC	False	CLUSTERING OF MULTI-TEMPORAL FULLY POLARIMETRIC L-BAND SAR DATA FOR AGRICULTURAL LAND COVER MAPPING		['2.  METHODOLOGY ', 'Method ']	Bruzzone,; Smola,; Hilbert	Smola,	['In  machine  learning,  kernel  methods  are  used  for  classification,  clustering,  regression,  density  estimation  and  visualization  with  heterogeneous  types  of  data,  such  as  time  series,  images,  strings  or  objects  (Schölkopf  and  Smola,  2002).']
TAN, KOAY et al. - CLASSIFICATION OF MULTITEMPORAL SAR IMAGES	False	CLASSIFICATION OF MULTI-TEMPORAL SAR IMAGES FOR RICE CROPS USING COMBINED ENTROPY DECOMPOSITION AND SUPPORT VECTOR MACHINE TECHNIQUE		[]			
TEIMOURI, DYRMANN et al. - A NOVEL SPATIOTEMPORAL FCNLSTM NETWORK	True	A Novel Spatio-Temporal FCN-LSTM Network for Recognizing Various Crop Types Using Multi-Temporal Radar Images		['2. Materials', '3. Methods']	Sentinel; Denmark; Denmark	Denmark; Denmark	['Since the area used for evaluating the network varies geographically and in terms of soil and crop types, the results are believed to be generalizable to the rest of Denmark.', 'It is observed that the satellite data were collected from specific geographic regions because of the distribution of various agricultural crop types in these areas in growth season for di erent crops in Denmark.']
TIAN, PEI et al. - GARLIC AND WINTER WHEAT IDENTIFICATION	True	Garlic and Winter Wheat Identification Based on Active and Passive Satellite Imagery and the Google Earth Engine in Northern China	Google Earth Engine in Northern China	['2. Study Area', '3. Materials and Methods']	Northern China; China; China; Zhongmou county, Qixian county, Jinxiang county,; Pizhou city,; Daming county (	Northern China; China; China; Zhongmou county, Qixian county, Jinxiang county,; Pizhou city,; Daming county (	['The study area is located in Northern China with a geographical range of 113.5 to 118.5 E and 34 to 36.6 N, as shown in Figure 1.', 'The study area is one of the main producing areas of garlic and winter wheat in China.', 'There are six China protected geographical indication products (CPGI, http://www.cpgi.org.cn/) for garlic in the study area, i.e., Zhongmou county, Qixian county, Jinxiang county, Lanling (Cangshan) county, Pizhou city, and Daming county (Figure 1b).']
TIAN, WU et al. - EFFICIENT IDENTIFICATION OF CORN CULTIVATION	True	Efficient Identification of Corn Cultivation Area with Multitemporal Synthetic Aperture Radar and Optical Images in the Google Earth Engine Cloud Platform		['2.1. Study Area']	Hebei Province,; Hebei; Bohai Sea; Beijing; Tianjin in the; Taihang Mountain; Yanshan; North China; Hebei Province; Hebei Province; Hebei,; Chengde, Zhangjiakou; Chengde, Zhangjiakou	Hebei Province,; Hebei; Bohai Sea; Beijing; Tianjin in the; Taihang Mountain; Yanshan; North China; Hebei Province; Hebei Province; Hebei,; Chengde, Zhangjiakou; Chengde, Zhangjiakou	['         The study area is Hebei Province, which includes 11 prefecture-level cities (Figure 1).', 'Hebei is adjacent to the Bohai Sea to the east, Beijing and Tianjin in the inner area, Taihang Mountain to the west, and Yanshan to the north, and it encompasses the North China Plain to the southeast, which is Hebei Province’s major corn production area.', 'The total cropland area of Hebei Province is 65,200 km2 (out of 188,800 km2 of total province area), and the corn area is 31,910 km2, accounting for approximately 48.94% of the total cropland according to 2016 national census data [                   ].', 'The crops in Hebei, except in the northwest region, are grown for two seasons: winter wheat crops are grown during the prior year’s winter (October to November) and harvested in the summer (May to June) of Rpermiootre Syenesa.', 'Occasionally, cotton is sown in the northwestern part of this region, including Chengde, Zhangjiakou and certain mountainous areas, spring (March to April) and harvested in the autumn (September to October).', 'part of this region, including Chengde, Zhangjiakou and certain mountainous areas, corn is planted in Details and further information about the major crop calendar in this region are exhibited in Figure the spring (April to May) and harvested in the autumn (September to October).']
TOMPPO, ANTROPOV et al. - CROPLAND CLASSIFICATION USING SENTINEL1 TIME	True	Cropland Classification Using Sentinel-1 Time Series: Methodological Performance and Prediction Uncertainty Assessment		['2. Materials and Methods', '2.3. Methods']	southwest Finland,; Food Authority; Finland (; Tomppo; Halme; SAR Metrics Used in the	southwest Finland,; Finland (	['         The methods were developed and the results demonstrated and discussed using one test site from southwest Finland, located in the Eura municipality (Figure 1), crop data from the test site, provided by the Finnish Food Authority [                   ] and seventeen 17 Sentinel-1 scenes.', 'Nearest neighbour methods became popular in forest and other environmental applications since they were launched for forest inventory applications in the early 1990s in Finland (e.g., [                       ]).']
TORBICK, SALAS - MAPPING AGRICULTURAL WETLANDS	True	Mapping agricultural wetlands in the Sacramento Valley, USA with satellite remote sensing	Sacramento Valley, USA	['Methods', 'Study area']	central Valley of California, USA; Sacramento Valley region; central California; Rice; Pacific Flyway; EPA; California Air Resources Board,; California; Rice; northern Valley region; USDA; NCM HW; Valley	central Valley of California, USA; Sacramento Valley region; central California; Pacific Flyway; California; northern Valley region; Valley	['          The study area (center *121.5W, 38.25N) in this application covers 33,000 km2 across the entire northern and central Valley of California, USA.', 'Figure 1 displays the Sacramento Valley region within central California with a color relief digital elevation model (DEM).', 'The ecosystem serves as habitat for many species of migratory waterfowl and is a key geography along the Pacific Flyway                       .', 'According to the EPA’s 2011 national greenhouse gas inventory and California Air Resources Board, rice production in California is responsible for 0.6 million metric tons (MMT) of CO2 equivalent annually.', 'Most paddies are clustered in the northern Valley region with some watersheds comprised of more than 50 % rice land use.', 'Climate varies across the Valley with the area classified as temperate with warm to hot (*28 C) summer months and cool winters (*6 C).']
ULABY, LI et al. - CROP CLASSIFICATION USING AIRBORNE RADAR	False	Supporting Research		[]			
ULLOA, CHIANG et al. - FLOOD PROXY MAPPING WITH NORMALIZED	True	Flood Proxy Mapping with Normalized Di erence Sigma-Naught Index and Shannon's Entropy		['3. Materials', '4. Methods']	European Space Agency (; European Space Agency (		
URBAN, SCHELLENBERG et al. - USING SENTINEL1 AND SENTINEL2 TIME	True	Article Using Sentinel-1 and Sentinel-2 Time Series for Slangbos Mapping in the Free State Province, South Africa	Free State Province, South Africa	['2. Materials antdral Mdaetatahroeedxsamined to conclude the temporal variations observing Seriphium plumosum.', '2.3. Methods']	Ladybrand in the east; Botshabelo in the west (; Highveld; SAR; GAMMA Remote Sensing AG,; Gümligen, Switzerland)	Ladybrand in the east; Botshabelo in the west (; Highveld	['90 km by 50 km (4500 km2) aTrheeamloonciatotreindgionf stlhanegFborseeenScrtoaatcehmPernotvwinascecabrreietdwoeuetnonthaneatpopwronx.s90ofkmLabdyybrand in the east and5B0oktms h(4a5b00eklom²i)nartehaelowcateesdtin(FthigeuFrreee S1t)a.te Province between the towns of Ladybrand in the east and Botshabelo in the west (Figure 1).', '          The region is part of the Highveld grassland ecosystem (1300 m–1700 m a.s.l.']
USEYA, CHEN - EXPLORING THE POTENTIAL OF MAPPING	True	Exploring the Potential of Mapping Cropping Patterns on Smallholder Scale Croplands Using Sentinel-1 SAR Data		['Study Area and Data', '2.1 Study area', 'Methodology']	CIMMYT; Harare, Zimbabwe; CIMMYT; Chipinge; Zimbabwe,; Zimbabwe; Africa; Zimbabwe; Zimbabwe; Zimbabwe	Harare, Zimbabwe; Chipinge; Zimbabwe,; Zimbabwe; Africa; Zimbabwe; Zimbabwe; Zimbabwe	['          Two study sites were chosen for this research, the first location is CIMMYT research station and a few neighboring fields situated in Harare, Zimbabwe bounded by 17°43′14″E and 17°44′16″E, 30°59′40″S and 31°15′00″S with an average altitude of 1489 m (Fig.', '          The second study site is Middle Sabi Estates in Chipinge district, Zimbabwe, bounded by latitudes of 20º08′12″E and 20º23′38″E and longitudes 32º18′07″S and 32º23′58″S (Fig.', '          Zimbabwe is a landlocked country in the Southern part of Africa and is generally an agricultural based country with a well-developed and diversified agricultural sector producing food crops and cash crops.', 'As of 2015, agriculture accounted for 18% of Zimbabwe’s gross domestic product (GDP)                       .', 'Zimbabwe has two distinct seasons, namely summer and winter.', 'Zimbabwe has a temperate climate.']
USTUNER, SANLI - POLARIMETRIC TARGET DECOMPOSITIONS AND LIGHT	True	Polarimetric Target Decompositions and Light Gradient Boosting Machine for Crop Classification: A Comparative Evaluation		['2. Study Site and Dataset']	Konya city	Konya city	['The test site contains about 42 km2 of agricultural land, and it is situated approximately 65 km north of Konya city center (see Figure 1), extending from 38 430 to 38 530 North latitudes and 32 430 to 32 530 East longitudes.']
USTUNER, SANLI et al. - AN APPLICATION OF ROLLINVARIANT POLARIMETRIC	False	AN APPLICATION OF ROLL-INVARIANT POLARIMETRIC FEATURES FOR CROP CLASSIFICATION FROM MULTI-TEMPORAL RADARSAT-2 SAR DATA		['2. METHODOLOGY']			
VALCARCE-DINEIRO, ARIAS-PEREZ et al. - MULTITEMPORAL DUAL AND QUADPOLARIMETRIC SYNTHETIC	True	Multi-Temporal Dual- and Quad-Polarimetric Synthetic Aperture Radar Data for Crop-Type Mapping		['2. Materials and Methods', '2.1. Study Area and Ground Truth']	central Spain; Castilla; Mediterranean; Castilla; Agriculture Technological Institute of Castilla	central Spain; Mediterranean; Agriculture Technological Institute of Castilla	['The study area is located in central Spain and covers an area of approximately 35 km x 18 km in the Castilla y Leon region (Figure 1).', 'The climate is continental semiarid Mediterranean characterized by dry and warm summers and cool to mild and wet winters.', 'Since 2011, the Agriculture Technological Institute of Castilla y Leon (ITACCroypL)Tmypaep seNrvuimceb(ehrtotpf:p//lmotcssncTyol.ittaalcayrle.eas(/hena/)desAcvaergraag)eharseuapodfaptleodtst h(heaL) U/LC maps annually.']
VAN, T, K, GOBIN et al. - SYNERGISTIC USE OF RADAR SENTINEL1	True	Synergistic Use of Radar Sentinel-1 and Optical Sentinel-2 Imagery for Crop Mapping: A Case Study for Belgium	Belgium	['2. Materials and Methods']	Integrated Administration; (IACS); Land Parcel Information System (; Belgium,; Belgium	Belgium,; Belgium	['In Belgium, this is arranged at the regional level, resulting in two similar datasets for the Flemish and the Walloon regions.', 'Belgium’s utilized agricultural land covers 1,341,487 ha, out of which 30% is grassland, 2% permanent crops, and 68% arable land.']
VENKATESAN, PAZHANIVELAN et al. - MULTITEMPORAL FEATURE EXTRACTION FOR PRECISE	True	MULTI-TEMPORAL FEATURE EXTRACTION FOR PRECISE MAIZE AREA MAPPING USING TIME-SERIES SENTINEL 1A SAR DATA		['METHODOLOGY', 'Study area']	Tamil Nadu; Perambalur; Ariyalur	Tamil Nadu; Perambalur; Ariyalur	['Ariyalur and Perambalur are inland districts of Tamil Nadu with an area of 1949 sq.km and 1757 sq.km, respectively.', 'Black and red loamy are the predominant soil types in Perambalur district.', 'Sugarcane and cashew are the major crops of Ariyalur district.']
VERMA, KUMAR et al. - KHARIF CROP CHARACTERIZATION USING COMBINATION	True	Kharif crop characterization using combination of SAR and MSI Optical Sentinel Satellite datasets		['2. Study area and data', '2.1 Study area', '3. Methodology']	Ranchi; Kanke,; Ratu; eastern India (; South Koel; Ranchi; Kanke; Ratu; MSI; European Space Agency (; Sentinel Scientific Data Hub (; LULC; LULC	Ranchi; eastern India (; South Koel; Ranchi	['          The study area comprises administrative blocks of Ranchi district namely, Kanke, Mandar, and Ratu blocks, located in the eastern India (figure 1).', 'The main river systems are Subarnarekha, South Koel and its tributaries.', 'Ranchi has a hilly topography with dense tropical forest.']
VERMA, NANDAN - KNOWLEDGE BASED CLASSIFIER BASED	False	KNOWLEDGE BASED CLASSIFIER BASED ON BACKSCATTERING COEFFICIENT FOR MONITORING THE CROP GROWTH ANALYSIS USING MULTI-TEMPORAL IMAGES OF SPACE-BORNE SYNTHETIC APERTURE RADAR (SAR) SENSORS		[]			
VESCOVI, GOMARASCA - INTEGRATION OF OPTICAL AND MICROWAVE	False	INTEGRATION OF OPTICAL AND MICROWAVE REMOTE SENSING DATA FOR AGRICULTURAL LAND USE CLASSIFICATION		[]			
VESTERGAARD, DAHL et al. - CLASSIFICATION OF POLARIMETRIC SAR DATA	False	Classification of Polarimetric SAR Data Using Dictionary Learning		[]			
VILLA, STROPPIANA et al. - INSEASON MAPPING OF CROP TYPE	True	In-Season Mapping of Crop Type with Optical and X-Band SAR Data: A Classification Tree Approach Using Synoptic Seasonal Features		['2. Materials', '2.1. Study Area', '3. Methods']	Lombardy region, northern Italy (; Milan; Po river; Lombardy; Rice	Lombardy region, northern Italy (; Milan; Po river; Lombardy	['          The study area is located in Lombardy region, northern Italy (Figure 1); it lies south of Milan and it is bordered by the Po river.', 'The most economically valuable crop types cultivated in Lombardy are (in per cent of total cropland area): maize (38.5%), temporary and permanent meadows used for forages (34.1%), rice (10.1%), winter cereals (wheat and barley, 7.5%), soybean and other legumes (2.7%), and vegetables (1.4%) [                       ].']
WANG, CAO et al. - A REVIEW OF DEEP LEARNING	False	A Review of Deep Learning in Multiscale Agricultural Sensing		[]			
WANG, CHEN et al. - CROPS PLANTING STRUCTURE AND KARST	True	Crops planting structure and karst rocky desertification analysis by Sentinel-1 data		['2 Materials and methods', '2.1 Study area', '3 Methods']	Anshun city, Guizhou province,; Guizhou; China; Multisource; Google; GE; ESA; State Engineering Technology; Anshun; Anshun	Anshun city, Guizhou province,; Guizhou; China; Anshun; Anshun	['The study area shown in Figure 1 is located in Anshun city, Guizhou province, between 106°3ʹ0ʺ E to 106°17ʹ22ʺ E and 26°11ʹ7ʺ N to 26°23ʹ38ʺ N, covering an area of approximately 322.11 km².', 'Those are scarce resources in Guizhou province which is the only province in China without any plain.', '2018 to Aug. 2018 with IW mode and VV nomic data such as Anshun statistical yearbook were downpolarization were chosen for crop classification (Table 2).', 'loaded from the web of Anshun people’s government.']
WANG, LI et al. - ANALYSIS OF COMBINING SAR	True	Analysis of Combining SAR and Optical Optimal Parameters to Classify Typhoon-Invasion Lodged Rice: A Case Study Using the Random Forest Method		['2. Study Area and Data', '2.1. Study Area']	Qindeli; Tongjiang City, Heilongjiang Province, China (; Heilongjiang Province,; China; Qindeli Farm	Qindeli; Tongjiang City, Heilongjiang Province, China (; Heilongjiang Province,; China; Qindeli Farm	['The study area is situated within Qindeli farm (Figure 1), Tongjiang City, Heilongjiang Province, China (47 51031” N, 133 7032” E).', 'The study area is located in a humid monsoon climate zone, in the third accumulated temperature zone in Heilongjiang Province, being one of the important commodity grain production bases in China.', 'The total cultivated area of Qindeli Farm is about 52,800 hectares, of which rice planting accounts for more than 80% of the total cultivated area.']
WANG, LIU et al. - DRYLAND CROP CLASSIFICATION COMBINING MULTITYPE	True	Dryland Crop Classification Combining Multitype Features and Multitemporal Quad-Polarimetric RADARSAT-2 Imagery in Hebei Plain, China	Hebei Plain, China	['2.11.. Study Site Description', '3. Methodology']	Fiigguurree; Hebei	Hebei	['The ssttuuddyy ssiittee ((3377°33000′––337°45′0 N, 115°15′0–115°3355′0 EE;; Fiigguurree 1) is llooccated iinn JJiizzhhoouu county,, Hebei provinccee,, CChhiinnaa..ThTihsiscocuonutnytywawsacshcohseonseans athsethsetusdtyudayrearbeeacabuecsaeuitselieits liinesthine tmheidmdildedolef oHfeHbeeibepilapilnaiannadndisisrerpeprerseesnentattaitvievneensesssooffththisisppllaaiinn iinn ccrroopp ppllaannttiinngg cchhaarraacctteerriissttiiccss..JJiizzhhoouucocouunntytyhahsaas taottaoltalalnldanadreaaroefa9o1f89k1m82k,man2d,aitnsdteirtrsatinerirsaflinatiasnfdlaotpaennd wopitehnawnietlhevaantieolnevraatniogne orafnapgeproofxaimpparteox2i3m–2a9tem2.3S–2a9ndmy.lSoaanmdaynldoalmighatnldoalmighcot mlopamrisecothmempraiisne stohiel tmypaeins wsoitihlitnypthees swtuitdhyinartehae, wsthuidcyh aarreeav,ewryhsiuchitaabrlee vfoerrythseuciutalbtilveatfioorntohfedcruylltaivnadctiroonpso.fTdhreylraengdiocnrohpass.aTsheemrie-ghiuomn ihdacsoantsienmeni-thalummoidnscooonntincleinmtaaltem.oTnhseoaovnercaligmeaatne.nTuhael taevmerpaegreataunrenuisal13te.1m0peCr.atTuhree aivse1r3a.g1e0 a°nCn.uTahl epraevceipraitgaetioannniusaalppprreocxiipmitaatteiolyn 4i6s1a.8p0pmromxi-, mmoastetloyf4w6h1.i8c0h mfamlls, dmuorsintgofJwulhyi–cShepfatlelmsdbuerr.ing July–September.']
WEI, ZHANG et al. - MULTITEMPORAL SAR DATA LARGESCALE CROP	True	Multi-Temporal SAR Data Large-Scale Crop Mapping Based on U-Net Model		['2. Methods', '3. Study Area and Data']	SAR; SAR; Umodel; Fuyu City	Umodel	['In this paper, a multi-temporal SAR data large-scale crop mapping algorithm based on the Umodel was proposed, and the flow of our method is shown in Figure 1.']
XIAO, XU et al. - MAPPING PADDY RICE WITH SENTINEL12	True	Mapping Paddy Rice with Sentinel-1/2 and Phenology-, Object-Based Algorithm-A Implementation in Hangjiahu Plain in China Using GEE Platform	Hangjiahu Plain in China	['2. Study Area and Datasets', '2.1. Study Area']	Zhejiang province, China; Yangtze Delta; Lake Tai; Qiantang RiverHangzhou Bay; Tianmu Mountains; Jiaxing,; Huzhou,; Hangzhou; Lake Tai; Grand Canal,; China; Zhejiang province,; Zhejiang province	Zhejiang province, China; Yangtze Delta; Qiantang RiverHangzhou Bay; Tianmu Mountains; Jiaxing,; Huzhou,; Hangzhou; Lake Tai; Grand Canal,; China; Zhejiang province,; Zhejiang province	['The Hangzhou–Jiaxing–Huzhou (HJH) Plain, or Hangjiahu Plain, is the largest plain in Zhejiang province, China and is an integral part of the Yangtze Delta.', 'and is bound by Lake Tai to the north, the Qiantang River/Hangzhou Bay to the south, and the Tianmu Mountains to the west.', 'It includes all of the prefecture-level city of Jiaxing, most of Huzhou, and the northeastern part of Hangzhou.', 'The topography is generally low-lying and flat at around a 3-m elevation, though it is slightly higher to the south and east with lower slopes towards Lake Tai.', 'Its river and canal network, including the Grand Canal, is 12.7 km per km2 (20.4 mi per sq.', '), which is the densest area in China.', '          The HJH Plain is the primary rice production region in Zhejiang province, which belongs to the single cropping japonica rice area [                       ].', 'The rice area accounts for 28.1% of all rice planting in Zhejiang province.']
XIE, LAI et al. - CROP MONITORING AND CLASSIFICATION USING	True	Crop Monitoring and Classification Using Polarimetric RADARSAT-2 Time-Series Data Across Growing Season: A Case Study in Southwestern Ontario, Canada	Southwestern Ontario, Canada	['2. Materials and Methods', '2.1. Study Site and Dataset']	London in southwestern Ontario, Canada	London in southwestern Ontario, Canada	['The study site is located in an agricultural area near the city of London in southwestern Ontario, Canada.']
XIE, WANG et al. - ON THE USE OF NEUMANN	True	On the Use of Neumann Decomposition for Crop Classification Using Multi-Temporal RADARSAT-2 Polarimetric SAR Data		['2. Study Site and RADARSAT-2 Dataset', '2.1. Study Site Description']	London, Ontario, Canada (	London, Ontario, Canada (	['The study site is located in London, Ontario, Canada (Lat/Lon, N42.8 /W81.5 ) and the Pauli RGBRiemmoateg\xa0Seenfsr.']
XIONG, THENKABAIL et al. - NOMINAL 30M CROPLAND EXTENT MAP	True	Nominal 30-m Cropland Extent Map of Continental Africa by Integrating Pixel-Based and Object-Based Algorithms Using Sentinel-2 and Landsat-8 Data on Google Earth Engine		['2. Materials', '2.1. Study Area', '3. Methods']	Africa; Africa; Africa; Africa	Africa; Africa; Africa; Africa	['          We have chosen the entire continent of Africa for the study area (Figure 1), which extends from approximately 38 N to 35 S , occupies 3037 million hectares (Mha), and has 7 distinct geologic and bio-geographic regions with varying land cover types [                       ].', 'Demographic changes of continental Africa are expected to be staggering in the 21st Century with population expected to increase from the current 1.2 billion to over 4 billion by the end of the Century [                       ].', 'Africa is endowed with a wide diversity of agro-ecological zones.', 'Thereby, a precise and accurate cropland extent map of Africa is of significant importance to study crop dynamics, water security, and food security.']
XU, ZHANG et al. - CROP CLASSIFICATION BASED ON TEMPORAL	True	Crop Classification Based on Temporal Information Using Sentinel-1 SAR Time-Series Data		['2. Methodology']			
YANG, WANG et al. - HIGHRESOLUTION RICE MAPPING BASED	True	Communication High-Resolution Rice Mapping Based on SNIC Segmentation and Multi-Source Remote Sensing Images		['2. Materials']	Xinghua City, Jiangsu Province, East China (; Xinghua City, Jiangsu Province, East China (; Mfaryo	Xinghua City, Jiangsu Province, East China (; Xinghua City, Jiangsu Province, East China (; Mfaryo	['The study area is located in Xinghua City, Jiangsu Province, East China (Figure 1).', 'The study area is located in Xinghua City, Jiangsu Province, East China (Figure 1).', 'The cropping system in the study area is mainly characterized by two cbroyptswaoyceraorpasnadypeaardadnydripcaedids ythreicmeaisinthseummaminersucrmopmwerhcorosepgwrohwosienggrsoewasionng season starts starts from Mfaryo mto MNaoyvetmoNbeorv.eTmhebaerv.eTrahgeeasvoewraigneg sdoawteinogf pdaadtedoyfrpicaedidnythriecestiundtyhaersetaudisy area is May']
YEKKEHKHANY, SAFARI et al. - A COMPARISON STUDY OF DIFFERENT	False	A Comparison Study of Different Kernel Functions for SVM-based Classification of Multi-temporal Polarimetry SAR Data		['2.  METHODOLOGY ']	SAR		
ZHANG, WANG et al. - CROP CLASSIFICATION USING MSCDN CLASSIFIER	False	Crop Classification Using MSCDN Classifier and Sparse Auto-Encoders with Non-Negativity Constraints for Multi-Temporal, Quad-Pol SAR Data		['2. Methodology', 'Method', 'Method', 'Method']	Len Duw Spw; LSTM		
ZHANG, WU - CROP CLASSIFICATION BY FORWARD NEURAL	False	Crop Classification by Forward Neural Network with Adaptive Chaotic Particle Swarm Optimization		[]			
