filename_only	use_xml	title	title_locations	methods_sections	content_locations	content_locations_filtered	location_sentences
ABDIKAN, SEKERTEKIN et al. - BACKSCATTER ANALYSIS USING MULTITEMPORAL SENTINEL1	True	BACKSCATTER ANALYSIS USING MULTI-TEMPORAL SENTINEL-1 SAR DATA FOR CROP GROWTH OF MAIZE IN KONYA BASIN, TURKEY	KONYA BASIN, TURKEY	['2. MATERIALS AND METHODOLOGY', '2.1 Study Area: Konya']	Konya; central Anatolia Turkey,	Konya; central Anatolia Turkey,	['        The test area is located at Konya basin, central Anatolia Turkey, which is approximately 40 km2.']
ABUBAKAR, WANG et al. - MAPPING MAIZE FIELDS BY USING	True	Mapping Maize Fields by Using Multi-Temporal Sentinel-1A and Sentinel-2A Images in Makarfi, Northern Nigeria, Africa	Makarfi, Northern Nigeria, Africa	['2. Materials and Methods', '2.1. Study Area']	Makarfi Local Government Area (central; Kaduna State, Nigeria (; Kaduna State; Northern Guinea; SAR	Kaduna State, Nigeria (; Kaduna State; Northern Guinea	['          Makarfi Local Government Area (central latitude 11 22’N and longitude 7 52’E) located in Kaduna State, Nigeria (Figure 1).', 'Makarfi is one of the major maize growing areas of Kaduna State and has higher average productivity compared to other local government areas [                       ].', 'The study area within the Northern Guinea savannah agro-ecological zone [                       ], is characterized by undulating plain with Cambisols and Acrisols dominated soil types.']
AINSWORTH, WILLIAMS - A SIMULATION STUDY OF TOPOGRAPHIC	False	A SIMULATION STUDY OF TOPOGRAPHIC EFFECTS ON POLSAR CLASSIFICATION OF FORESTS AND CROPS		[]			
ALVISI, VOLTA et al. - PREDICTORS OF WEANING OUTCOME	False	Predictors of weaning outcome in chronic obstructive pulmonary disease patients		['Materials and methods']	S. Anna Hospital); American Thoracic Society; MORRIS et; ARF; ARF	S. Anna Hospital)	['The initial weaning trial included 81 COPD patients admitted to the authors’ intensive care unit (ICU; S. Anna Hospital) for management of acute respiratory failure (ARF).']
AMELARD, WONG et al. - UNSUPERVISED CLASSIFICATION OF AGRICULTURAL LAND	True	UNSUPERVISED CLASSIFICATION OF AGRICULTURAL LAND COVER USING POLARIMETRIC SYNTHETIC APERTURE RADAR VIA A SPARSE TEXTURE DICTIONARY MODEL Robert Amelard, Alexander Wong, David A. Clausi		['2. METHODOLOGY']	Pauli		
ARIAS, CAMPO-BESCOS et al. - CROP CLASSIFICATION BASED ON TEMPORAL	True	Crop Classification Based on Temporal Signatures of Sentinel-1 Observations over Navarre Province, Spain	Navarre Province, Spain	['2. Materials and Methods', '2.1. Study Area', '4.4. Regional Stratification', '4.5. Methodological Aspects']	Navarre (Northern Spain); Navarre; Navarre; Southern Navarre,; RMSE	Navarre (Northern Spain); Navarre; Navarre; Southern Navarre,	['          The study area covers the agricultural areas of the province of Navarre (Northern Spain).', 'Due to this diversity, Navarre is stratified in seven agricultural regions with distinct agro-climatic conditions [                       ] (Table 1).', 'Other summer crops cultivated in Navarre are sunflower, found in every region, and rice, only grown in southern regions.', 'It is important to mention that the proportion of fallow fields varies strongly depending on the region, being particularly high in Southern Navarre, especially in region 7.']
ASHMITHA, N, M, MOHAMMED, A, J et al. - ESTIMATION OF COTTON AND MAIZE	True	ESTIMATION OF COTTON AND MAIZE CROP AREA IN PERAMBALUR DISTRICT OF TAMIL NADU USING MULTI-DATE SENTINEL-1A SAR DATA	PERAMBALUR	['2. MATERIALS AND METHODS', '2.1 Study area', 'Methodology']	Perambalur; Tamil Nadu; North East; South West; Cotton,; Tapioca, Paddy,; SAR; SAR	Perambalur; Tamil Nadu; North East; South West; Tapioca, Paddy,	['Perambalur district is a centrally located inland district of Tamil Nadu with a spread over of 1750 sq.kms.', 'The area receives a mean annual rainfall of 908 mm out of which 475 mm is contributed by North East monsoon and 314 mm by South West monsoon.', 'Maize, Cotton, Sorghum, Onion, Tapioca, Paddy, Groundnut and Sesamum are the major cultivated crops.']
ASMAE, OMAR et al. - CROP TYPE MAPPING USING OPTICAL	False	Crop type mapping using optical and radar images: a review		[]			
AUBERT, BAGHDADI et al. - TOWARD AN OPERATIONAL BARE SOIL	False	Toward an Operational Bare Soil Moisture Mapping Using TerraSAR-X Data Acquired Over Agricultural Areas		['Study site ', 'Study site ']	Orgeval; Orgeval; Yzeron; Garon		
BAZZI, BAGHDADI et al. - AN OPERATIONAL FRAMEWORK FOR MAPPING	True	An Operational Framework for Mapping Irrigated Areas at Plot Scale Using Sentinel-1 and Sentinel-2 Data		['2. Materials', '2.1. Study Site', '3. Methods', '4.5. Method Generalization']	Orléans city of; France (; Orléans city,	Orléans city of; France (; Orléans city,	['The study site examined is located near Orléans city of north-central France (Figure 1).', 'The cumulative precipitation was recorded from a local metrological station located in Orléans city, during the period between May and October for the years 2017, 2018, 2019, and 2020 reached 321 mm, 210 mm, 150 mm, and 180 mm, respectively.']
BERIAUX, JAGO et al. - SENTINEL1 TIME SERIES FOR CROP	True	Article Sentinel-1 Time Series for Crop Identification in the Framework of the Future CAP Monitoring		['2. Materials and Methods', '2.1. Study Area', '2.3. Methodology']	Walloon region of; Belgium; Belgium (in; SAR	Walloon region of; Belgium; Belgium (in; SAR	['The study is carried out in the context of the preparation by the Walloon region of their implementation of the Area Monitoring System.', 'The cloud frequency in Belgium is quite significant, and the availability of cloud free image time series over the growing season can be a challenge.', 'The Walloon Region (WR) is located in the south part of Belgium (in grey on Figure 1) and covers 16,901 square kilometers.', 'This research describes the effect on the classification performance of 5 parameters: the set of explanatory variables, the SAR orbit (related to local incidence angle and acquisition time), the period of the year covered by the time series, the use of different internal buffers on parcel polygons before SAR signal extraction, and the training set characteristics (size of the set and specific parcels kept in the set).']
BETBEDER, LASLIER et al. - MULTITEMPORAL OPTICAL AND RADAR DATA	True		no-title	['2. STUDY AREA']	Mont-SaintMichel, France (	Mont-SaintMichel, France (	['The investigated area is a Long Ecological Research site named ‘Zone Atelier Armorique’ (130 km²), localized on the southern part of the Bay of the Mont-SaintMichel, France (http://osur.univ-rennes1.fr/za-armorique/) (Figure 1) and referenced in the']
BINDLISH, JACKSON et al. - HIGH RESOLUTION SOIL MOISTURE MAPPING	False	High Resolution Soil Moisture Mapping Using AIRSAR Observations During SMEX02		[]			
BOUSBIH, ZRIBI et al. - SOIL MOISTURE AND IRRIGATION MAPPING	False	Soil Moisture and Irrigation Mapping in A Semi-Arid Region, Based on the Synergetic Use of Sentinel-1 and Sentinel-2 Data		['2. Study Site and Database', '2.1. Study Site', '3. Methodology']	Tunisia; Tunisia; WCM,	Tunisia; Tunisia	['The Kairouan plain (Central Tunisia: 9◦53(cid:48)57”E; 35◦34(cid:48)51”N; Figure 1a) is a semi-arid, typically agricultural region.', 'Study Site The Kairouan plain (Central Tunisia: 9°53′57″E; 35°34′51″N; Figure 1a) is a semi-arid, typically agricultural region.']
BOUVET, LE, T, T et al. - MONITORING OF THE RICE CROPPING	False	Monitoring of the Rice Cropping System in the Mekong Delta Using ENVISAT/ASAR Dual Polarization Data	Mekong	[]			
BRINKHOFF, VARDANEGA et al. - LAND COVER CLASSIFICATION OF NINE	True	Land Cover Classification of Nine Perennial Crops Using Sentinel-1 and -2 Data		['2. Methods', '2.1. Study Area']	Leeton; Griffith; Riverina, NSW, Australia; Murrumbidgee River	Leeton; Riverina, NSW, Australia; Murrumbidgee River	['This study focused on the area surrounding the Leeton and Griffith townships within the Riverina, NSW, Australia.', 'Irrigated agriculture is a major industry in these areas, with irrigation water supplied from the Murrumbidgee River.']
BUCKLEY, SMITH - MONITORING GRASSLANDS WITH RADARSAT 2	False	Joseph R. Buckley		[]			
BUSQUIER, LOPEZ-SANCHEZ et al. - ADDED VALUE OF COHERENT COPOLAR	False	Added Value of Coherent Copolar Polarimetry at X-Band for Crop-Type Mapping		[]			
BUSQUIER, VALCARCE-DINEIRO et al. - FUSION OF MULTITEMPORAL PAZ	False	Fusion of Multi-Temporal PAZ and Sentinel-1 Data for Crop Classification		['2. Materials and Methods']	Iberian Peninsula (Spain), in the Castilla y León region,; Salamanca (; Meteorological Agency,; Spain, the	Iberian Peninsula (Spain), in the Castilla y León region,; Salamanca (; Spain, the	['The study area is located in the Iberian Peninsula (Spain), in the Castilla y León region, 20 km away from the city of Salamanca (Figure 1).', 'Due to the pandemic lockdown during the spring of 2020 in Spain, the ﬁeld campaign was only possible at the end of June.']
CABALLERO, PLATZECK et al. - ASSESSMENT OF MULTIDATE SENTINEL1 POLARIZATIONS	True	Assessment of Multi-Date Sentinel-1 Polarizations and GLCM Texture Features Capacity for Onion and Sunflower Classification in an Irrigated Valley: An Object Level Approach	Irrigated Valley	['2. Materials and Methods']	SAR		
CAO, YU et al. - A 30 M TERRACE MAPPING	True	A 30 m terrace mapping in China using Landsat 8 imagery and digital elevation model based on the Google Earth Engine	China	['Methods']			
CAPODICI, D'URSO et al. - INVESTIGATING THE RELATIONSHIP BETWEEN XBAND	True	Investigating the Relationship between X-Band SAR Data from COSMO-SkyMed Satellite and NDVI for LAI Detection		['2.3. Methods']	CSK		
CASTRO, FEITOSA et al. - A COMPARATIVE ANALYSIS OF DEEP	False	A Comparative Analysis of Deep Learning Techniques for Sub-tropical Crop Types Recognition from Multitemporal Optical/SAR Image Sequences		[]			
CASTRO, FEITOSA et al. - AN HYBRID RECURRENT CONVOLUTIONAL NEURAL	False	AN HYBRID RECURRENT CONVOLUTIONAL NEURAL NETWORK FOR CROP TYPE RECOGNITION BASED ON MULTITEMPORAL SAR IMAGE SEQUENCES		[]			
CHAKHAR, HERNANDEZ-LOPEZ et al. - IMPROVING THE ACCURACY OF MULTIPLE	True	Improving the Accuracy of Multiple Algorithms for Crop Classification by Integrating Sentinel-1 Observations with Sentinel-2 Data		['2. Materials and Methods']	Castilla-La Mancha, southeast Spain (	Castilla-La Mancha, southeast Spain (	['        The study area covers the agricultural fields in the province of Castilla-La Mancha, southeast Spain (Figure 1).']
CHATTERJEE, SAHA et al. - UNSUPERVISED LAND COVER CLASSIFICATION	False	Unsupervised Land Cover Classification of Hybrid and Dual-Polarized Images Using Deep Convolutional Neural Network		[]			
CHAUHAN, DARVISHZADEH et al. - DISCRIMINANT ANALYSIS FOR LODGING SEVERITY	True	Discriminant analysis for lodging severity classification in wheat using RADARSAT-2 and Sentinel-1 data		['2. Materials and methods', '2.1. Study area and in situ measurements']	Bonifiche Ferraresi; Jolanda; Ferrara, Northern Italy; LA (; Chauhan et; CAI; LA in	Bonifiche Ferraresi; Ferrara, Northern Italy; LA (; LA in	['We carried out field measurements in Bonifiche Ferraresi farm (Fig.', '1) located in Jolanda di Savoia (centre coordinates 44°52′59″N, 11°58′48″E) a commune in the province of Ferrara, Northern Italy.', '          We calculated a normalised lodging score index (LS, [0–1]) per plot based on CAI (θ, [0-90°]) and LA (%, [0–100%]) (see Eq.', 'From the plot centre, we visually assessed the LA in four quadrants (Fig.']
CHEN - POLARIMETRIC COHERENCE PATTERN A VISUALIZATION	False	Polarimetric Coherence Pattern: A Visualization and Characterization Tool for PolSAR Data Investigation		[]			
CHEN, HAN et al. - LAND UTILIZATION MAPPING IN GUANGDONG	False		no-title	[]			
CHEN, HUANG et al. - CLASSIFICATION OF MULTIFREQUENCY POLARIMETRIC SAR	False		no-title	[]			
CHEN, USEYA et al. - DECISIONLEVEL FUSION OF SENTINEL1 SAR	True	Decision-level fusion of Sentinel-1 SAR and Landsat 8 OLI texture features for crop discrimination and classification: case of Masvingo, Zimbabwe	Masvingo, Zimbabwe	['2. Materials and methods', '2.1. Study area', '2.3. Methodology']	Masvingo province,; Zimbabwe; Mozambique in the eastern; Matabeleland South; Midlands; Manicaland; Zimbabwe; Zimbabwe; Lowveld; Save-Limpopo; Zimbabwe	Masvingo province,; Zimbabwe; Mozambique in the eastern; Matabeleland South; Midlands; Manicaland; Zimbabwe; Zimbabwe; Lowveld; Save-Limpopo; Zimbabwe	['          The area under study is in Masvingo province, which is situated in the south-east of Zimbabwe.', 'The province shares boundary with Mozambique in the eastern part and Matabeleland South province is to the southern part, Midlands province is to the north and west part, whereas, Manicaland province to the north-east part [                       ].', 'It has an area of 56,566 km2, approximately 14.48% of the total area of Zimbabwe.', 'Zimbabwe experiences a bimodal rainfall pattern and it has three distinct seasons namely: (i) a wet and hot season from mid-November to March (summer); (ii) a dry and cold, season from April to July (winter); and (iii) a dry and hot season from August to mid-November (spring).', '          It is situated in the Lowveld with an altitude below 900 m, and agroecological regions III, IV, and V with a very low mean rainfall of below 600 mm in the Save-Limpopo valley.', 'Land reform program implemented in Zimbabwe since 1980 led to an agrarian structure accounting for up to 98% small-scale farms of the total agriculture land [                       ].']
CHEN, WANG et al. - UNIFORM POLARIMETRIC MATRIX ROTATION THEORY	False	Uniform Polarimetric Matrix Rotation Theory and Its Applications		[]			
CHRISTOVAM, SHIMABUKURO et al. - EVALUATION OF SAR TO OPTICAL	False	EVALUATION OF SAR TO OPTICAL IMAGE TRANSLATION USING CONDITIONAL GENERATIVE ADVERSARIAL NETWORK FOR CLOUD REMOVAL IN A CROP DATASET		['3.  MATERIAL AND METHODS ']	SAR; Green,; NIR,; SAR	SAR	['The  optical  images were provided in surface reflectance and the SAR images  in sigma nought (σ0) in dB scale.']
CUI, ZHANG et al. - INTEGRATION OF OPTICAL AND SAR	True	Integration of optical and SAR remote sensing images for crop-type mapping based on a novel object-oriented feature selection method		['Study area and datasets', '2.1 Study area']	Bohu; Yanqi counties of Xinjiang Uygur Autonomous Region; Bosten Lake; China; Xinjiang Uygur Autonomous Region,; SAR	Bohu; Yanqi counties of Xinjiang Uygur Autonomous Region; Bosten Lake; China; Xinjiang Uygur Autonomous Region,	['The study area is located in an agricultural district stretching over Bohu and Yanqi counties of Xinjiang Uygur Autonomous Region that faces Bosten Lake to the east, which is the largest inland freshwater lake in China.', 'This area is one of the most productive agricultural regions in Xinjiang Uygur Autonomous Region, mainly for food crops (maize and winter wheat) and economic crops (tomatoes, beets, cotton and fruit).']
D'ANDRIMONT, LEMOINE et al. - TARGETED GRASSLAND MONITORING AT PARCEL	True	Targeted Grassland Monitoring at Parcel Level Using Sentinels, Street-Level Images and Field Observations		['2. Materials and Methods', '2.1. Study Area', '2.3. Methods']	Netherlands; Netherlands (; Gelderland,; Ede, Wageningen,; Barneveld, Arnhem, Putten; Netherlands; WMS,; BRP; Land Parcel Information System (; BRP; Copernicus; Google; CSV; Europe; SLC; UTC; UTC	Netherlands; Netherlands (; Gelderland,; Ede, Wageningen,; Netherlands; Europe	['For this study, an area in the Netherlands was chosen as a large amount of high quality geo-information is available under open access license there, including very detailed annual agricultural parcel sets.', 'Secondly, grassland and maize are the two most important crops in terms of cultivated area in the Netherlands (with 52.0% and 13.3%, respectively).', 'The study site is the Gelderse Vallei, which is part of the province of Gelderland, and includes 7 municipalities: Ede, Wageningen, Renkum, Barneveld, Arnhem, Putten and Nijkerk (Figure 1).', '          The Netherlands open geo-data infrastructure exposes to the public a large number of very high quality reference datasets, using various protocols (e.g., WMS, WFS, atom downloads).', 'Starting with the operational status of Sentinel 1B in late September 2016, it is now possible to generate coherence with a 6-day temporal baseline over Europe.']
DE, C, H, DE, C, O et al. - RICE CROP DETECTION USING LSTM	True	Rice Crop Detection Using LSTM, Bi-LSTM, and Machine Learning Models from Sentinel-1 Time Series		['2. Study Area', '3. Materials and Methods']	Brazil; Brazil; Rio Grande; Argentina (	Brazil; Brazil; Rio Grande; Argentina (	['Brazil was the tenth largest producer of milled rice in 2018/2019 [86].', 'Apart from Asian countries, Brazil became the most significant global producer.', '2020, 12, x FOR PEER REVIEW 3 of 26 the national production, with 80% of the production, where the State of Rio Grande do Sul is the do Sul, on the border with Argentina (Figure 1).']
DE, KUMAR et al. - STUDY ON CLASSIFICATION OF LAND	True	Study on classification of land cover targets over parts of Burdwan, West Bengal using RISAT-1 hybrid polarimetric SAR images and optical remote sensing data	Burdwan, West Bengal	['STUDY AREA AND DATA SOURCES']	Burdwan; WB, India; Burdwan; LISS IV; United States Geological Survey (; Earth Science Data Interface	Burdwan; WB, India; Burdwan	['The test site has been chosen in the parts of Burdwan district, WB, India and its surroundings for investigation of crop monitoring and other land cover targets.', 'RISAT-1 hybrid SAR data has been acquired in circular fine resolution strip map (cFRS) mode on 18th Dec, 2014 over the parts of Burdwan with a central latitude of 23.2324° N, central longitude of 87.8615° E and at incidence angle of 47.54618°.']
DEL, F, F, SCHIAVON et al. - CROP CLASSIFICATION USING MULTICONFIGURATION CBAND	False	Crop Classification Using Multiconfiguration C-Band SAR Data		[]			
DEMAREZ, HELEN et al. - INSEASON MAPPING OF IRRIGATED CROPS	True	In-Season Mapping of Irrigated Crops Using Landsat 8 and Sentinel-1 Time Series		['2. Study Site and Data', '2. Study Site and Data', '3. Method', '3. Method']			
DEMIRKESEN, DEMIRPOLAT et al. - CLASSIFICATION OF AGRICULTURAL AREAS	False	Tarımsal Alanların Çok Zamanlı TerraSAR-X Görüntülerinde Morfolojik Profiller Kullanılarak Sınıflandırılması Classification of Agricultural Areas in Multi- temporal TerraSAR-X Images using Morphological Profiles		[]			
DESCALS, SZANTOI et al. - OIL PALM ELAEIS GUINEENSIS MAPPING	True	Oil Palm (Elaeis guineensis) Mapping with Details: Smallholder versus Industrial Plantations and their Extent in Riau, Sumatra	Riau, Sumatra	['2. Materials and Methods', '2.1.3. Study Area']	Copernicus; European Space Agency; SAR; SAR Ground Range Detected (		
DESHPANDE, KUMAR et al. - INTEGRATION OF C BAND SAR	True	Integration of C band SAR and optical temporal data for identification of paddy fields		['3 Study area and\xa0data used', '4 Methodology and\xa0approach']	Haridwar, Uttarakhand, India,; River Ganges; India, the; PCM; NDVI; NDVI; SMIC (	Haridwar, Uttarakhand, India,; River Ganges; India, the	['The study area is situated on the east side of Haridwar, Uttarakhand, India, toward national highway 74 as seen in Fig.', 'River Ganges oflws through the district, and hence, the land here is fertile and conducive for agriculture.', 'In India, the monsoon season coincides with the transplanting season for paddy crop.']
DEY, BHOGAPURAPU et al. - UNSUPERVISED CLASSIFICATION OF CROP GROWTH	True	Unsupervised Classification of Crop Growth Stages with Scattering Parameters from Dual-Pol Sentinel-1 SAR Data		['2. Methodology', '2.1. Study Area and Dataset']	Canada; southern Manitoba (; Manitoba (; Manitoba Canola	Canada; southern Manitoba (; Manitoba (	['The test site in Canada is located in southern Manitoba (49°4003200N, 97°5905700S).', 'The in-situ measurements were conducted during Soil Moisture Active Passive Validation Experiment 2016 Manitoba (SMAPVEX16-MB) campaign.']
DEY, CHAUDHURI et al. - SYNERGISTIC USE OF TANDEMX	False	Synergistic Use of TanDEM-X and Landsat-8 Data for Crop-type Classification and Monitoring		['Methods']			
DI, M, T, GUINVARC'H et al. - BEETS OR COTTON BLIND EXTRACTION	False	Beets or Cotton? Blind Extraction of Fine Agricultural Classes Using a Convolutional Autoencoder Applied to Temporal SAR Signatures		[]			
DIMOV, KUHN et al. - ASSESSMENT OF CROPPING SYSTEM DIVERSITY	True	ASSESSMENT OF CROPPING SYSTEM DIVERSITY IN THE FERGANA VALLEY THROUGH IMAGE FUSION OF LANDSAT 8 AND SENTINEL-1		['1.2 Study area', '3. METHODOLOGY']	Kokand (; Uchkuprik, Baghdad; Fergana Valley; eastern Uzbekistan, northern Tajikistan,; western Kyrgyzstan,; Naryn-Syrdarya river; SAR; Simpson Index of Diversity (	Kokand (; Uchkuprik, Baghdad; Fergana Valley; eastern Uzbekistan, northern Tajikistan,; western Kyrgyzstan,; Naryn-Syrdarya river; SAR	['         The study area is located within the surroundings of the alluvial fan south of the city of Kokand (districts Uchkuprik, Baghdad and Rishton) in the southern part of the Fergana Valley which is located between eastern Uzbekistan, northern Tajikistan, and western Kyrgyzstan, characterized by a semi-arid climate and a rapidly growing population of about 14 Mio peop                   ).', 'from the Naryn-Syrdarya river system.', 'Image fusion is performed to enhance the spatial resolution of the multispectral Landsat image and to test the ingestion of the SAR backscatter into the optical data in order to derive more detailed land use information with a spatial resolution of 10m per pixel.']
DOBRINIC, GASPAROVIC et al. - SENTINEL1 AND 2 TIMESERIES	True	Sentinel-1 and 2 Time-Series for Vegetation Mapping Using Random Forest Classification: A Case Study of Northern Croatia	Northern Croatia	['2. Study Area and Datasets', '2.1. Study Area']	Croatia	Croatia	['          The Med¯imurje County, illustrated in Figure 1, is one of the main crop product regions and is the northernmost part of Croatia.']
DOBSON, ULABY - PRELIMINARY EVALUATION OF THE SIRB	False	Preliminaly Evaluation of the		[]			
DURAND, GIMONET et al. - SAR DATA FILTERING FOR CLASSIFICATION	False	Data Filtering for Classification		[]			
DUSSEUX, CORPETTI et al. - COMBINED USE OF MULTITEMPORAL OPTICAL	False	Combined Use of Multi-Temporal Optical and Radar Satellite Images for Grassland Monitoring		['2. Study Site and Datasets']	Datasets; Brittany, France (; Brittany; Yar	Brittany, France (	['The study was performed on a catchment area of 61.5 km2 located in central-north Brittany, France (Figure 1).']
FELEGARI, SHARIFI et al. - INTEGRATION OF SENTINEL 1	True	Integration of Sentinel 1 and Sentinel 2 Satellite Images for Crop Mapping		['2.1. Study Area']	Tarom City (Zanjan Province), Iran,; Tarom	Tarom City (Zanjan Province), Iran,	['This research was carried out in Tarom City (Zanjan Province), Iran, which has a wide range of climates (Figure 2).']
FENG, CHEN et al. - LAND COVER CLASSIFICATION BY SUPPORT	False	LAND COVER CLASSIFICATION BY SUPPORT VECTOR MACHINES USING MULTI- TEMPORAL POLARIMETRIC SAR DATA		[]			
FENG, ZHENG et al. - DYNAMIC COSINE METHOD FOR NORMALIZING	True	Dynamic Cosine Method for Normalizing Incidence Angle Effect on C-band Radar Backscattering Coefficient for Maize Canopies Based on NDVI		['2.1. Study Site and Data Sets']	Jilin Province in northeast China (; Changchun, Songyuan, Siping,; Jilin city (; Songliao Plain in northeast China; China,; Sentinel Satellite Data Distribution Network of the European Space Agency (	Jilin Province in northeast China (; Changchun, Songyuan, Siping,; Jilin city (; Songliao Plain in northeast China; China,	['          The study site is located in the central part of Jilin Province in northeast China (123 080~127 090 E, 43 100~44 510 N) with an area of approximately 250 km 160 km, covering Changchun, Songyuan, Siping, and Jilin city (Figure 1).', 'It belongs to the hinterland of the Songliao Plain in northeast China.', 'It is one of the most important commercial maize production bases in China, and one of the three major black soil regions as well as three golden maize belts in the world [28].']
FERRANT, SELLES et al. - DETECTION OF IRRIGATED CROPS	True	Detection of Irrigated Crops from Sentinel-1 and Sentinel-2 Data to Estimate Seasonal Groundwater Use in South India	South India	['2. Materials and Methods', '2.1. Study Area']	Kudaliar river; Telangana State, South India,; India,; Andhra Pradesh State; India; Rabi; Hyderabad (; Southwest; Indian Meteorological Department; (Gajwel,; Rabi; Kharif,; Rabi; Rabi	Kudaliar river; Telangana State, South India,; India,; India; Hyderabad (; Southwest; Indian Meteorological Department; Kharif,	['          The Kudaliar river catchment (983 km2) is shown in Figure 1.', 'It is located in Telangana State, South India, and is the youngest state in India, formed after the Andhra Pradesh State 2014 Reorganisation Act.', 'Figure 1 shows the fraction crop cover in India for two seasons, Kharif 2015 (Figure 1a) and Rabi 2016 (Figure 1b).', 'The catchment is 50 km north of Hyderabad (Figure 1c).', 'The region has a semi-arid climate controlled by the periodicity of the Southwest monsoon: a rainy “Kharif” (local name) season from June to November and a dry “Rabi” (local name) season from December to March.', 'Annual precipitation (1980–2000) ranges from 540 mm to 1300 mm with a mean of 879 mm according to the Indian Meteorological Department [                       ]; 88% of the rain falls during the monsoon season.', 'Daily irrigation rates for rice are 12 mm/day and 9 mm/day for Rabi and Kharif, respectively [                       ].']
