filename_only	use_xml	title	title_locations	methods_sections	content_locations	content_locations_filtered	location_sentences
LUO, QI et al. - USING TIME SERIES SENTINEL1 IMAGES	True	Article Using Time Series Sentinel-1 Images for Object-Oriented Crop Classification in Google Earth Engine		['2. Materials and Methods']			
LUSSEM, HUTT et al. - COMBINED ANALYSIS OF SENTINEL1	True	COMBINED ANALYSIS OF SENTINEL-1 AND RAPIDEYE DATA FOR IMPROVED CROP TYPE CLASSIFICATION: AN EARLY SEASON APPROACH FOR RAPESEED AND CEREALS		['2. STUDY AREA AND DATA', '3. METHODS']	Germany; North Rhine-Westphalia; LULC	Germany; North Rhine-Westphalia	['The study area is part of the Rur-Watershed in North RhineWestphalia, Germany.', 'For a more accurate crop type classification an additional dataset of agricultural boundaries provided by the agricultural chamber of North Rhine-Westphalia was implemented to separate agricultural land and pasture from other land use/land cover (LULC) types (Waldhoff et al., 2012).']
MA - IMPROVING SAR TARGET RECOGNITION PERFORMANCE	False	Improving SAR Target Recognition Performance Using Multiple Preprocessing Techniques		['Method type']			
MAHDIANPARI, MOHAMMADIMANESH et al. - MIDSEASON CROP CLASSIFICATION USING DUAL	True	Mid-season Crop Classification Using Dual-, Compact-, and Full-Polarization in Preparation for the Radarsat Constellation Mission (RCM)		['2. Study Area and Dataset']	Red River Watershed, Manitoba, Canada (; Manitoba; NASA	Red River Watershed, Manitoba, Canada (; Manitoba	['The study area is an agricultural area located in the Red River Watershed, Manitoba, Canada (Figure 1).', 'Southern Manitoba is characterized by a typical sub-humid to a humid continental climate, and experiences temperature variations between 30 C and 30 C [20].']
MASHABA-MUNGHEMEZULU, CHIRIMA et al. - DELINEATING SMALLHOLDER MAIZE FARMS	True	Delineating Smallholder Maize Farms from Sentinel-1 Coupled with Sentinel-2 Data Using Machine Learning		['2. Materials and Methods', '2.1. Study Area']	Makhuduthamaga; Limpopo, South Africa (; u47r2a8l Research Council	Makhuduthamaga; Limpopo, South Africa (	['          The field data were collected from the Makhuduthamaga district in Limpopo, South Africa (Figure 1).']
MEHTA, PARIHAR et al. - DISCRIMINATION BETWEEN BABUL PLANTATIONS	True	Discrimination between Babul plantations and Mustard crop using Polarimetric C- and L- band data		['Material and Methods']	Jaisalmer; Rajasthan (; Babul; Thar Desert; Radarsat; Radarsat	Jaisalmer; Rajasthan (; Thar Desert	['The study area lies in Jaisalmer district, Rajasthan (Fig.', 'The area forms a part of Thar Desert.']
MINH, AVTAR et al. - MONITORING AND MAPPING OF RICE	True	Monitoring and Mapping of Rice Cropping Pattern in Flooding Area in the Vietnamese Mekong Delta Using Sentinel-1A Data: A Case of An Giang Province	Flooding Area in the	['2. Materials and Methods', '2.1. Study Area']	Giang province,; Lower Mekong river; Vietnam (; An Giang; Bassac; Mekong Rivers; Giang; Cambodia in the Northwest; Giang	Giang province,; Lower Mekong river; Vietnam (; Bassac; Cambodia in the Northwest	['          The study site is located in the An Giang province, which belongs to upstream of the Lower Mekong river basin in Vietnam (Figure 1).', 'The rice production depends heavily on the freshwater availability and sediment supplied from the Bassac and Mekong Rivers [                       ].', 'An Giang has an area of 3406 sq.km and borders with Cambodia in the Northwest.']
MIRZAEE, MOTAGH et al. - CLASSIFICATION OF AGRICULTURAL FIELDS USING	True	Classification of agricultural fields using time series of dual polarimetry TerraSAR-X images		['2.1 Study area']	north east of Doroud city in Lorestan province, Iran	north east of Doroud city in Lorestan province, Iran	['Our test site is located in the north east of Doroud city in Lorestan province, Iran.']
MOHITE, SAWANT et al. - OPERATIONAL NEAR REAL TIME RICE	True	OPERATIONAL NEAR REAL TIME RICE AREA MAPPING USING MULTI-TEMPORAL SENTINEL-1 SAR OBSERVATIONS		['Study Area']	AP; Guntur, Krishna, West; East Godavari; Krishna rivers (; Rice; Rabi; Cotton, Chilli,; GLC; ESA,; Andhra Pradesh	Guntur, Krishna, West; East Godavari; Cotton, Chilli,; Andhra Pradesh	['         The study on rice area mapping has been carried out in the four districts from coastal AP namely Guntur, Krishna, West and East Godavari.', 'Other crops cultivated in the region are Sugarcane, Cotton, Chilli, Pulses, Coconut, etc.', 'In this study we have used Sentinel-1A and 1B satellite imagery, GLC dataset                   developed by ESA, ground truth data collected from the field visits and mKRISHI R and crop acreage statistics from department of agriculture, Andhra Pradesh.']
MOHITE, SAWANT et al. - WHEAT AREA MAPPING AND PHENOLOGY	True	WHEAT AREA MAPPING AND PHENOLOGY DETECTION USING SYNTHETIC APERTURE RADAR AND MULTI-SPECTRAL REMOTE SENSING OBSERVATIONS		['2.1 Study Area']	Punjab; Haryana states of India (; Punjab; Bhatinda, Fatehgarh Sahib, Ludhiana, Mansa, Moga, Patiala, Rupnagar; Sangrur; Ambala,; Yamunanagar, Kaithal,; Kurukshetra, Panchkula; Panipat; Haryana; India,; PunjabHaryana; Rabi; Rice	Punjab; Haryana states of India (; Punjab; Bhatinda, Fatehgarh Sahib, Ludhiana, Mansa, Moga, Patiala, Rupnagar; Sangrur; Ambala,; Yamunanagar, Kaithal,; Kurukshetra, Panchkula; Panipat; Haryana; India,	['The study area is located in Punjab and Haryana states of India (Figure 1).', 'The districts selected from the Punjab are Bhatinda, Fatehgarh Sahib, Ludhiana, Mansa, Moga, Patiala, Rupnagar and Sangrur.', 'The districts such as Ambala, Sonepat, Yamunanagar, Kaithal, Karnal, Kurukshetra, Panchkula and Panipat are selected from Haryana.', 'Wheat is one of the important cereal crops cultivated all across India, with PunjabHaryana being the prime contributor states to the total production.']
MOUMNI, LAHROUNI - MACHINE LEARNINGBASED CLASSIFICATION FOR CROPTYPE	True	Machine Learning-Based Classification for Crop-Type Mapping Using the Fusion of High-Resolution Satellite Imagery in a Semiarid Area		['2. Materials and Methods', '3. Methodology']	Haouz; Marrakech-Safi; central Morocco; Sidi Rahal region; Marrakech (; Google Earth Archives; Google; CNES; Haouz; Morocco); MAJA; NDVI, VV, VH,; NDVI,	Haouz; Marrakech-Safi; central Morocco; Sidi Rahal region; Marrakech (	[')e plain of Haouz is a vast plain of 6000 km 2 of surface which stretches over a length of approximately 150 km from east to west in the region of Marrakech-Safi located in central Morocco and including part of the HautAtlas.', '        In this work, we are interested in the left part of the irrigated sectors, in the Haouz plain, called R3 perimeter and located in the Sidi Rahal region about 40 km east of the city of Marrakech (Figure 1).']
MURAD - INVESTIGATION OF THE GROUNDWATER SUITABILITY	True	INVESTIGATION OF THE GROUNDWATER SUITABILITY FOR IRRIGATION PRACTICES IN AN ARID REGION: CASE STUDY		['2. MATERIALS AND METHODS']	UAE; Arabian Peninsula; Al Hayer; Al Ain; Abu Dhabi Emirate (; Meteorological Department of National Authority of; Al Ain; Al Ain region; Al Ain; Al Ain region; (EC); Hydrogeology Laboratory at UAE University; Soluble Sodium Percentage (	UAE; Arabian Peninsula; Al Ain; Abu Dhabi Emirate (; Meteorological Department of National Authority of; Al Ain; Al Ain region; Hydrogeology Laboratory at UAE University	['The UAE is located in the southeastern part of the Arabian Peninsula between latitudes 22° 40’ and 26° 00’ N and longitudes 51° 00’ and 56° 00’ E. The study area namely Al Hayer is situated within the northern part of Al Ain area and northeastern part of Abu Dhabi Emirate (Fig.', 'Based on rainfall data from 1995-August 2007 obtained from the Meteorological Department of National Authority of Communication- UAE, the rainfall amount in Al Ain area varied between 0.2 mm in April 1998 to 58.8 mm in April 2003.', 'The maximum annual average of rainfall in Al Ain region was 0.5 mm in 1996, whereas the minimum annual average was nearly zero in 2001.', 'The collected water samples were transported to the Hydrogeology Laboratory at UAE University for further analyses.']
MUSTAK, UDAY et al. - EVALUATION OF THE PERFORMANCE	True	EVALUATION OF THE PERFORMANCE OF SAR AND SAR-OPTICAL FUSED DATASET FOR CROP DISCRIMINATION		['2. STUDY AREA AND DATASETS USED', '2.1 Study area', '3. METHODOLOGY']	Wayanad; Kerala,; Bathery; Wayanad District in Kerala; Koppen; Wayanad; Kerala	Wayanad; Kerala,; Bathery; Wayanad District in Kerala; Wayanad; Kerala	['The Sultan Bathery region of Wayanad district in the state of Kerala, both staple crops such as paddy and cash crops such as Coffee, Rubber, Coconut and Arecanut are grown.', 'The study area is the part of Bathery taluk of Wayanad District in Kerala which is shown in figure 1.', 'The main objective of this paper is to evaluate the performance of optical, Synthetic Aperture Radar (SAR) and optical-SAR fused imageries for crop discrimination in Sultan Bathery Taluk of Wayanad district in Kerala using machine learning algorithms.']
MUTHUKUMARASAMY, SHANMUGAM et al. - SAR POLARIMETRIC DECOMPOSITION WITH ALOS	True	SAR polarimetric decomposition with ALOS PALSAR-1 for agricultural land and other land use/cover classification: case study in Rajasthan, India	Rajasthan, India	['Study area', 'Methodology']	Ramgarh; Jaisalmer; Rajasthan, India,; Thar Desert, the; Indira Gandhi Canal the northern; Indira Gandhi Canal (; Ramgarh; Bragg; SAR; FCC of IRS; IRS; (NRSC); Google Earth; SAR Data Processing and Education Tool); SLC; SRTM; Alaska	Ramgarh; Jaisalmer; Rajasthan, India,; Thar Desert, the; Indira Gandhi Canal the northern; Indira Gandhi Canal (; Ramgarh; Bragg; Google Earth; Alaska	['The study area is located in Ramgarh village of Jaisalmer district in Rajasthan, India, with an aerial extent 2 of 143 km .', 'Being a part of the great Thar Desert, the area is sandy, dry, unkind to all forms of life (www.', 'However, after the construction of the Indira Gandhi Canal the northern part of the district is irrigated and has become green.', 'Agriculture is the dominant land use in this region along the Indira Gandhi Canal (www.', 'The volume scattering from babul plantations, double-bounce nature of Ramgarh village settlements and Bragg scattering from sand dunes are the characteristic elements of the study area.', 'The same was verified using high-resolution satellite data from Google Earth.', 'All the three polarimetric decomposition parameters were orthorectified using satellite orbital information and external SRTM 3 arc-seconds digital elevation model (DEM) using Alaska Satellite Facility (ASF) MapReady tool.']
NAJIB, KANNIAH et al. - SYNERGY OF ACTIVE AND PASSIVE	True	Synergy of Active and Passive Remote Sensing Data for E ective Mapping of Oil Palm Plantation in Malaysia	Oil Palm Plantation in Malaysia	['2.1. Study Region', '2.3. Methods']	Malaysia; Southeast Asia; Peninsular	Malaysia; Southeast Asia; Peninsular	['Malaysia is a tropical maritime country located in Southeast Asia and consists of Peninsular']
NAVARRO, ROLIM et al. - CROP MONITORING BASED ON SPOT5	False	Crop Monitoring Based on SPOT-5 Take-5 and Sentinel-1A Data for the Estimation of Crop Water Requirements		['2. Materials and Methods', '2.3. Method']	Wako-Kungo (; Cela Municipality, South-Kwanza Province, Angola (; Wako-Kungo region; NDVI; NDVI; NDVI; NDVI	Wako-Kungo (; Cela Municipality, South-Kwanza Province, Angola (; Wako-Kungo region	['The test area covers an irrigation perimeter close to the town of Wako-Kungo (11˝25133”S, 15˝06110”E), which is located in the Cela Municipality, South-Kwanza Province, Angola (Figure 1).', 'The Wako-Kungo region is located on a plateau zone higher than 1200 m. This region has a warm temperate climate with a marked wet season from October to April and an average annual precipitation of approximately 1250 mm.']
NDIKUMANA, MINH et al. - APPLYING DEEP LEARNING FOR AGRICULTURAL	False	Applying deep learning for agricultural classification using multitemporal SAR Sentinel-1 for Camargue, France	France	[]			
NDIKUMANA, MINH et al. - DEEP RECURRENT NEURAL NETWORK	False	Deep Recurrent Neural Network for Agricultural Classification using multitemporal SAR Sentinel-1 for Camargue, France	France	['2. Study Area']	France,; Mediterranean Sea; Mediterranean; Cevennes; Southern Alps; Camargue Regional Natural Park,	France,; Mediterranean Sea; Mediterranean; Cevennes; Southern Alps; Camargue Regional Natural Park,	['The Camargue region, located in south-eastern France, is a coastal area of the Mediterranean Sea.', 'It has a Mediterranean climate with mild winters, a long summer period (hot and dry), irregular rainfall and sunshine.', 'Its climate has peculiarities related to its geographical location south of the Rhone corridor, between the Cevennes and the Southern Alps.', 'This zone covers the current perimeter of the Camargue Regional Natural Park, with an area of around 110,000 ha [24].']
NEETU, PRASHNANI et al. - UNDERSTANDING CROP GROWING PATTERN	True	UNDERSTANDING CROP GROWING PATTERN IN BARDHAMAN DISTRICT OF WEST BENGAL USING MULTI-DATE RISAT 1 MRS DATA	BARDHAMAN; BENGAL	['2. STUDY AREA AND DATA SETS', 'METHODOLOGY 3.1']	Bardhaman District of West Bengal; Bardhaman; south Bengal; Birbhum, Murshidabad; Dumka of; Nadia; Hooghly, Bankura; Purulia; West Bengal; Kharif Rice, Rabi; Bardhaman	Bardhaman District of West Bengal; Bardhaman; south Bengal; Birbhum, Murshidabad; Nadia; Hooghly, Bankura; Purulia; West Bengal; Kharif Rice, Rabi	['The study area includes a few blocks of Bardhaman District of West Bengal.', 'Bardhaman district is situated in the central part of south Bengal.', 'It is surrounded by Birbhum, Murshidabad and Dumka of Jharkhand on the north, Nadia on the east, Hooghly, Bankura and Purulia on the south.', 'This part of West Bengal is major in Kharif Rice, Rabi rice and Potato growing area but less in Jute, sugarcane and Til (Sesame) growing.']
NELSON, SETIYONO et al. - TOWARDS AN OPERATIONAL SARBASED RICE	True	Towards an Operational SAR-Based Rice Monitoring System in Asia: Examples from 13 Demonstration Sites across Asia in the RIICE Project	Asia; Asia in the	['2.3. Study Site Characteristics', '3. Methods', '4.6. Regional-Scale Mapping and Monitoring of Rice Areas in Asia: A Way Forward']	Southeast Asia; Cambodia (; Takeo); Phka Romduol; Angkor Borey; Leyte East, Leyte West, Agusan del Norte; Visayas; Mindanao,; Nueva Ecija; San Jose, Sto; Domingo, Talavera; Aliaga; Upper Pampanga River; Rice; Nueva Ecija; SAR; Asia; Asian Development Bank; Japan; Europe, the; Rice Information Service); CSK, TSX,; Asia; Asia; SAR	Southeast Asia; Cambodia (; Angkor Borey; Leyte East, Leyte West, Agusan del Norte; Visayas; Mindanao,; Nueva Ecija; San Jose, Sto; Aliaga; Upper Pampanga River; Nueva Ecija; Asia; Japan; Europe, the; Asia; Asia	['         The 13 monitoring sites cover a range of environments, crop establishment methods, water management practices and varietal maturities that are typical of rice-growing areas in South and Southeast Asia.', 'Cambodia (Site 1, Takeo): In this area, farmers typically grow short-duration non-photoperiod-sensitive varieties (such as IR504) for the dry season, early wet season and recession rice.', 'Monitoring was conducted in four locations (three from Angkor Borey and one in Prey Kabas District) during the recession rice of October 2012, to April 2013.', 'Philippines (Sites 2, 3, 4 and 13, Leyte East, Leyte West, Agusan del Norte and Nueva Ecija): These sites represent three geographic areas of the country—Luzon, Visayas and Mindanao, respectively—characterized by different rice cropping practices.', 'The four municipalities monitored in Nueva Ecija were San Jose, Sto.', 'Domingo, Talavera and Aliaga.', 'They were classified as irrigated lowland, and they rely mainly on the release of irrigation water from the Upper Pampanga River Integrated Irrigation System (UPRIIS).', 'Crop establishment during the wet season, 2013, in Nueva Ecija started in July.', 'In addition to national-level projects, several consortia are demonstrating the value of rice crop monitoring with SAR across Asia and elsewhere.', 'Another project conducted by the Asian Development Bank and supported by the Japan Fund for Poverty Reduction aims to improve the quality and timeliness of rice crop area and production estimates and forecasts through SAR data [                   ].', 'In Europe, the ERMES (An Earth Observation Model-based Rice Information Service) project aims to develop a prototype of downstream service dedicated to the rice sector based on assimilation of EO and in situ data within crop yield modeling [                   ].', 'Current and forthcoming SAR systems, such as CSK, TSX, RADARSAT-2, RISAT-1, Sentinel-1 and ALOS-2, offer an unparalleled opportunity to deliver regular and systematic acquisitions of the rice crop in Asia.', 'This can be realized only if acquisition plans are aligned to the rice crop extent and rice crop calendar across Asia and if acquisitions are frequent enough.']
NGUYEN, CLAUSS et al. - MAPPING RICE SEASONALITY	True	Mapping Rice Seasonality in the Mekong Delta with Multi-Year Envisat ASAR WSM Data	Mekong Delta	['2. Study Area: Mekong Delta', '4. Methods and Data Analyses']	Mekong Delta (; Vietnam; Mekong River, the; Rice	Mekong Delta (; Vietnam; Mekong River, the	['         The Mekong Delta (MKD), Vietnam’s southernmost region and home to over 18 million inhabitants, covers an area of about 40,000 km2 between 8.5 11.5 N and 104.5 106.8 E and consists of 13 provinces, as depicted in Figure 2.', 'Due to its origin by accumulation of alluvial sediments from the Mekong River, the wide flat plain is mostly located below sea level and consists of fertile soils [                   ] and, like all deltas, it is vulnerable to a number of factors [                   ].']
NGUYEN, WAGNER - EUROPEAN RICE CROPLAND MAPPING	True	European Rice Cropland Mapping with Sentinel-1 Data: The Mediterranean Region Case Study		['2.1. Study Sites Characteristics', '2.2. Materials', '3. Methodology']	EU; Greece, Portugal; France; EU; Greece, Portugal; France; Nguyen et; Nguyen et; SAR IW	Greece, Portugal; France; Greece, Portugal; France	['           EU member countries followed by Greece, Portugal and France [                       ].', 'producer EU member countries followed by Greece, Portugal and France [                       ].']
NGUYEN, WAGNER et al. - RICEPLANDTED AREA EXTRACTION BY TIME	True	RICE-PLANDTED AREA EXTRACTION BY TIME SERIES ANALYSIS OF ENVISAT ASAR WS DATA USING A PHENOLOGY-BASED CLASSIFICATION APPROACH: A CASE STUDY FOR RED RIVER DELTA, VIETNAM	VIETNAM	['2. STUDY AREA & RICE CROP PHENOLOGY', '2.1 Study area']	Vietnam (; Gulf of Tonkin,; East Asia coast,	Vietnam (; Gulf of Tonkin,; East Asia coast,	['        Study area locates in the northern part of Vietnam (Lat.', '105.3\uf0b0 – 107.1\uf0b0 E), western coastal zone of the Gulf of Tonkin, includes 10 provinces and covers 2 approximately 15,000 km .', 'RRD is the second largest riceproducing area of the country and one of the five largest rivers on the of East Asia coast, almost flat plain with most of the land below 20 m (Figure 2).']
NIHAR, PATEL et al. - SUGARCANE CROP TYPE DISCRIMINATION	True	Sugarcane Crop Type Discrimination and Area Mapping at Field Scale Using Sentinel Images and Machine Learning Methods		['Materials and Methods', 'Study Area', 'Methodology']	Kisan Sahkari Chini Mill (; Nanauta in the; Saharanpur, Uttar Pradesh; Uttarakhand,; Dehradun; Haridwar; Saharanpur; West,; Ambala; Haryana; Saharanpur; East; District of Muzaffarnagar of Uttar Pradesh; South; 460; KSC Mill; Rice,; Saharanpur; KSCM; KSCM; SAR	Nanauta in the; Saharanpur, Uttar Pradesh; Uttarakhand,; Dehradun; Haridwar; Saharanpur; West,; Ambala; Haryana; Saharanpur; East; South; 460; Saharanpur	['The Kisan Sahkari Chini Mill (KSCM) Catchment located in the town of Nanauta in the district of Saharanpur, Uttar Pradesh was chosen as the area of interest for this study.', 'The districts of Uttarakhand, namely Dehradun and Haridwar neighbour Saharanpur by the North and the West, respectively; the Karnal and Ambala districts of Haryana border Saharanpur by the East and the District of Muzaffarnagar of Uttar Pradesh on the South.', 'The mill catchment contains sugarcane fields from around 165 villages covering a total area of over 460 square kilometres with an average sugarcane field size being 0.4 acres.', 'The Saharanpur district experiences a humid subtropical climate with annual precipitation ranging from 750 to 1200 mm and temperature ranging from 4 C in winters up to 40 C in summers.']
NIKAEIN, IANNINI et al. - ON THE VALUE OF SENTINEL1	False	On the Value of Sentinel-1 InSAR Coherence Time-Series for Vegetation Classification		['2. Study Area and Data', '3. Methods']	Campinas in the São Paulo state, Brazil; São Paulo; Google	Campinas in the São Paulo state, Brazil; São Paulo	['The study area is situated near Campinas in the São Paulo state, Brazil.', 'São Paulo has a tropical and subtropical climate with long and hot summers.']
NUMBISI, VAN, C, F et al. - DELINEATION OF COCOA AGROFORESTS USING	True	Delineation of Cocoa Agroforests Using Multiseason Sentinel-1 SAR Images: A Low Grey Level Range Reduces Uncertainties in GLCM Texture-Based Mapping		['2. Study Site', '2. Study Site', '3. Materials and Methods', '3. Materials and Methods']	Bakoa (in the; Bakoa (in the; Bokito District of the Mbam; Inoubou Department in the; Bokito District of the; Inoubou Department in the; Cameroon (; Cameroon (	Bakoa (in the; Bakoa (in the; Bokito District of the Mbam; Inoubou Department in the; Bokito District of the; Inoubou Department in the; Cameroon (; Cameroon (	['This study was conducted in the landscape of Bakoa (in the UTM zone 32N, and bounded This study was conducted in the landscape of Bakoa (in the UTM zone 32N, and bounded by the by the UTM coordinates 734280 m E 510975 m N and 747435 m N 501480 m E—a surface area of UTM coord2inates 734280 m E 510975 m N and 747435 m N 501480 m E—a surface area of 123.28 km2), 123.28 km ), which is located in the Bokito District of the Mbam and Inoubou Department in the which is located in the Bokito District of the Mbam and Inoubou Department in the center region of center region of Cameroon (Figure 1).', 'Cameroon (Figure 1).']
NURTYAWAN, SAEPULOH et al. - SATELLITE IMAGERY FOR CLASSIFICATION	True	Satellite Imagery for Classification of Rice Growth Phase Using Freeman Decomposition in Indramayu, West Java, Indonesia	Indramayu, West Java, Indonesia	['2. Materials and Methods', '2.1. Study Area', '2.4. Method']	Indramayu; Indramayu; Indramayu; Java Islands	Indramayu; Indramayu; Indramayu; Java Islands	['        The study area was located in Indramayu district (107°52’-108°36’ BT and 6°15’-6°40’ latitude) (Figure 1).', 'Field experiments were carried out at a typical paddy site in Indramayu.', 'The location of Indramayu district which stretches along the north coast of Java Islands.']
OLDONI, PRUDENTE et al. - POLARIMETRIC SAR DATA FROM SENTINEL1A	True	POLARIMETRIC SAR DATA FROM SENTINEL-1A APPLIED TO EARLY CROP CLASSIFICATION		['2. METHODOLOGY', '2.1 Study area']	Brazil; western Bahia state,; Campo Verde,; Mato Grosso state; LEM central; Maranhão, Tocantins, Piauí,; Bahia states; Municipal Agricultural Production; Brazilian Institute of Geography and Statistics (IBGE); LEM; Bahia; (IBGE,; Campo Verde; Campo Verde; Campo Verde,	Brazil; western Bahia state,; Campo Verde,; Mato Grosso state; Maranhão, Tocantins, Piauí,; Bahia states; Brazilian Institute of Geography and Statistics (IBGE); Bahia; Campo Verde; Campo Verde; Campo Verde,	['Two municipalities were selected in Brazil as test sites for this study (Figure 1).', 'One is Luís Eduardo Magalhães (LEM), located in western Bahia state, and the other is Campo Verde, located in the southeastern of the Mato Grosso state.', 'This municipality is inserted in the MATOPIBA economic region, which is an important agricultural frontier that comprises parts of Maranhão, Tocantins, Piauí, and Bahia states.', 'The LEM agricultural production is based mainly on soybean (179,540 ha), corn (19,136 ha), sorghum (14,000 ha), cotton (12,100 ha), and beans (7,910 ha); these numbers correspond to the planted area of each culture in 2018 according to the Municipal Agricultural Production survey (PAM, 2018), held by the Brazilian Institute of Geography and Statistics (IBGE).', 'Due to this agriculture importance, LEM has the 4th higher Gross Domestic Product (GDP), BRL 601,242.05 among Bahia municipalities (IBGE, 2017).', 'The central coordinates of Campo Verde are 15º37’19.4” S and 55º10’29.6” W (Figure 1b) and correspond an area of 4,794.56 km².', 'This municipality has an economic profile based on agribusiness, and according to the PAM survey (PAM, 2018), in 2018 Campo Verde was the 10th Brazilian municipality with the highest value of agricultural production (BRL 1,905,073).', 'In LEM and Campo Verde, two harvests are normally grown in one year.']
OLDONI, SANCHES et al. - LEM DATASET FOR AGRICULTURAL REMOTE	False	LEM+ dataset: For agricultural remote sensing applications		[]			
ORYNBAIKYZY, GESSNER et al. - CROP TYPE CLASSIFICATION USING FUSION	False	Crop Type Classification Using Fusion of Sentinel-1 and Sentinel-2 Data: Assessing the Impact of Feature Selection, Optical Data Availability, and Parcel Sizes on the Accuracies		['2. Materials and Methods', '2.1. Study Area', '2.4. Methodology']	Northern Germany; Brandenburg state; SAR Data Pre-Processing; Google; ESA,; Lee	Northern Germany; Brandenburg state	['The study site (Figure 1) is located in Northern Germany and covers the territory of Brandenburg state with an area of 29,654 km2, where 45% is agricultural land [38].']
